Name,Description,Latitude,Longitude,InfoURL,ImageURL
UCSB,A beatiful university located along California coast,34.416929,-119.845991,https://en.wikipedia.org/wiki/University_of_California,https://www.news.ucsb.edu/sites/default/files/styles/article_horizontal/public/images/2019/perko-storke-tower-5_0.jpg?itok=pXFH09HV
Universal Studio Hollywood,A wonderful theme park in Hollywood,34.138117,-118.353378,https://en.wikipedia.org/wiki/Universal_Studios_Hollywood,https://www.hollywoodreporter.com/wp-content/uploads/2021/04/GettyImages-1312701865-H-2021-1618602456.jpg?w=681&h=383&crop=1
Santa Monica Pier,A large pier with entertainment in Los Angelas,34.009242,-118.497604,https://en.wikipedia.org/wiki/Santa_Monica_Pier,https://pacpark.com/wp-content/uploads/2021/03/santa-monica-pier-rides-reopen-@pocket_details.jpg
Silicon Valley,Global center for high technology in Northern California,37.387474,-122.057543,https://en.wikipedia.org/wiki/Silicon_Valley,https://ychef.files.bbci.co.uk/1600x900/p05xhy8l.webp
Disney Land Park Anaheim,The first Disney theme park around the world,33.812092,-117.918974,https://en.wikipedia.org/wiki/Disneyland,https://upload.wikimedia.org/wikipedia/commons/thumb/e/e6/Pixarpiersunset2019_%28cropped%29.jpg/2560px-Pixarpiersunset2019_%28cropped%29.jpg
San Diego Zoo,One of the world's largest zoological association,32.735316,-117.149046,https://en.wikipedia.org/wiki/San_Diego_Zoo,https://media.nbcsandiego.com/2019/09/San-Diego-Zoo-entrance-generic-61020.jpg?quality=85&strip=all&fit=635%2C393&w=1775&h=998&crop=1